<?xml version="1.0" encoding="UTF-8"?>
<component
	xmlns="http://xmlfit.sourceforge.net/schema/1.0/component" 
	xmlns:xsi="http://www.w3.org/2001/XMLSchema-instance" 
	xsi:schemaLocation="http://xmlfit.sourceforge.net/schema/1.0/component/component.xsd">
	
		<parameter name="testParam" defaultValue="Test Default Param Value" />
		<parameter name="password" defaultValue="Test Default Param Password" />
		<parameter name="username" defaultValue="Test Default Param Password" />
		<parameter name="parmInner" defaultValue="http://localhost:8080/" />
        <parameter name="parmOut" defaultValue="${parmInner}telcenter/" />
        
        <tableFixture type="db.Table">
        	<command name="name">
        		<target>detailTable</target>
        	</command>
        	<column name="id" />
        	<column name="detail"/>
        	<row>
        		<value>1</value>
        		<value>My Detail Text</value>
        	</row>
        </tableFixture>
        
        <tableFixture type="db.Table">
        	<command name="name">
        		<target>detailTable</target>
        	</command>
        	<column name="id" />
        	<column name="detail"/>
        	<column name="description"/>
        	<column name="email"/>
        	<row>
        		<value>1</value>
        		<value>My Detail Text</value>
        		<value>meine description</value>
        		<value>test@test.de</value>
        	</row>
        </tableFixture>
        
        <tableFixture type="db.Table">
        	<command name="name">
        		<target>detailTable</target>
        	</command>
        	<row>
        		<value>1</value>
        		<value>My Detail Text</value>
        		<value>meine description</value>
        		<value>test@test.de</value>
        	</row>
        </tableFixture>
        
        <actionFixture>
            <command name="testCommandName">
                <target>${parmOut}</target>
            </command>
        </actionFixture>
        
		<actionFixture>
			<command name="testCommandName">
				<target>${testParam}</target>
			</command>
		</actionFixture>
	
		<actionFixture>
			<command name="testCommandName">
				<target>testTarget</target>
			</command>
		</actionFixture>
		
		<actionFixture>
			<command name="testCommandName">
				<target>testTarget</target>
				<comment>Test Comment</comment>
			</command>
		</actionFixture>
		
		<actionFixture>
			<command name="testCommandName">
				<target>testTarget</target>
				<value>testValue</value>
			</command>
		</actionFixture>
		
		<actionFixture>
			<command name="testCommandName">
				<target>testTarget</target>
				<value>testValue</value>
				<comment>test Comment</comment>
			</command>
		</actionFixture>
		
		<actionFixture type="fit.SeleniumFixture">
			<command name="testCommandName">
				<target>testTarget</target>
				<value>testValue</value>
			</command>
		</actionFixture>
		
		<actionFixture type="fit.SeleniumFixture">
			<command name="testCommandName">
				<target>testTarget</target>
				<value>testValue</value>
				<comment>test Comment</comment>
			</command>
		</actionFixture>
		
		<actionFixture>
			<command name="testCommandName">
				<target>testTarget</target>
			</command>
			<command name="testCommandName">
				<target>testTarget</target>
				<comment>test Comment</comment>
			</command>
			<command name="testCommandName">
				<target>testTarget</target>
				<value>testValue</value>
			</command>
			<command name="testCommandName">
				<target>testTarget</target>
				<value>testValue</value>
				<comment>test Comment</comment>
			</command>
		</actionFixture>
	
		<actionFixture>
			<command name="testCommandName">
				<target>testTarget</target>
			</command>
			<command name="testCommandName">
				<target>testTarget</target>
				<comment>test Comment</comment>
			</command>
			<command name="testCommandName">
				<target>testTarget</target>
				<value>testValue</value>
			</command>
			<command name="testCommandName">
				<target>testTarget</target>
				<value>testValue</value>
			</command>
		</actionFixture>
		
		<actionFixture>
			<command name="testCommandName">
				<target>testTarget</target>
			</command>
			<command name="testCommandName">
				<target>testTarget</target>
				<comment>test Comment</comment>
			</command>
			<command name="testCommandName">
				<target>testTarget</target>
				<value>testValue</value>
			</command>
			<command name="testCommandName">
				<target>testTarget</target>
				<value>test value 1</value>
				<value>test value 2</value>
				<comment>test Comment</comment>
			</command>
		</actionFixture>
	
        <comment>
            <heading>${defaultData}User DB Setup</heading>
            <description>Setup the User DB for the Test.</description>
        </comment>
    
		<columnFixture type="UserDbFixture">
			<column name="id" />
			<column name="username" />
			<column name="password" />
			<row>
				<value>1</value>
				<value>${username}</value>
				<value>${password}</value>
			</row>
		</columnFixture>
		
        <comment>
            <heading>Login - for User ${username} and Password ${password}</heading>
            <description>The Fixture doese the Login with Username and Password.</description>
        </comment>
    
		<actionFixture>
			<command name="start">
				<target>LoginFixture</target>
				<comment>Starte Applikation mit einem Login</comment>
			</command>
			<command name="enter">
				<target>username</target>
				<value>${username}</value>
			</command>
			<command name="enter">
				<target>password</target>
				<value>${password}</value>
			</command>
			<command name="special">
				<target>test</target>
				<value>01</value>
				<value>02</value>
				<value>03</value>
			</command>
			<command name="type">
				<target>loginForm:username</target>
				<value>Christian.Baranowski@pro-pix.de</value>
			</command>
			<command name="getAll">
				<value>Test VALUE ONE</value>
				<value>VALUE TWO</value>
			</command>
		</actionFixture>

</component>
